강의명,url,강사명,별점,별점 수,수강생 수,강의 수,강의 총 시간,category
Administração de e-mails com Zimbra em Multiplos Servidores,https://www.udemy.com/course/zimbra-multi-server/,FAME Treinamentos,4.3,119,928,44,300.0,IT_net_security
PFSense - Pacotes adicionais,https://www.udemy.com/course/pfsense-pacotes-adicionais/,Michael Soares,4.2,118,617,15,180.0,IT_net_security
CISSP Edición premium ¡Todos los dominios!,https://www.udemy.com/course/cissp-edicion-premium/,Melinton Navas,4.1,117,495,32,360.0,IT_net_security
メディアリテラシー マスター講座,https://www.udemy.com/course/media_literacy001/,定平 誠,4.2,117,447,28,300.0,IT_net_security
Curso Completo de Hacking Ético - El Original,https://www.udemy.com/course/hackingfull/,Jorge Mario Rodríguez,4.6,116,490,58,810.0,IT_net_security
Gestão de Riscos para à Segurança da Informação.,https://www.udemy.com/course/gestao-de-riscos-para-a-seguranca-da-informacao/,André Ricardo Mendes,4.5,116,398,34,180.0,IT_net_security
IPv6 Teoria e Prática,https://www.udemy.com/course/ipv6-teoria-e-pratica/,MARCELO MAGNO ESPÍNDOLA DE MELO,4.3,116,582,50,630.0,IT_net_security
Fortigate Firewall Eğitimi,https://www.udemy.com/course/fortigate-firewall-egitimii/,Eray Uçman,4.5,114,4549,64,600.0,IT_net_security
"Programlama Dilleriyle Orta, İleri Seviye Etik Hacker Kursu",https://www.udemy.com/course/programlama-dilleriyle-orta-ileri-seviye-etik-hacker-kursu/,Mustafa Berat Kurt,4.0,114,8977,109,780.0,IT_net_security
Passwort Hack mit Keylogger,https://www.udemy.com/course/passwort-hack-mit-keylogger/,Angel Gonzalez,3.8,114,2888,6,39.0,IT_net_security
APRENDA CITRIX XENSERVER(CITRIX HYPERVISOR) DO INICIO AO FIM,https://www.udemy.com/course/instalando-e-administrando-citrix-xenserver76/,Gilsomar Freire,4.4,114,443,60,510.0,IT_net_security
Análisis de redes y seguridad con Python,https://www.udemy.com/course/analisis-de-redes-y-seguridad-con-python/,CYFO Academy,4.8,111,15705,22,390.0,IT_net_security
Penetration Testing - Sızma Testi Uzmanı,https://www.udemy.com/course/penetration-testing-web-and-network/,Ali Çiftci,3.5,110,7073,119,630.0,IT_net_security
Azərbaycanca Etik Hacker Olma Kursu-Kali Linux və Python,https://www.udemy.com/course/azerbaycanca-etik-hacker-olma-kursu/,Zaur Qasımov,4.7,110,2651,124,930.0,IT_net_security
Seguridad Informática en Servidores Linux: Hardening,https://www.udemy.com/course/seguridad-informatica-servidores-linux-hardening-defensa-blueteam/,Antonio Sánchez Corbalán - LPI Training Partner,4.8,109,839,171,1320.0,IT_net_security
Administracion de servidor Web paso a paso,https://www.udemy.com/course/configurar-servidor-vps-desde-cero-a-experto/,Franklin Rony Cortez Barrera,4.1,109,494,52,360.0,IT_net_security
Mikrotik Hotspot,https://www.udemy.com/course/configuracion-y-administracion-de-hotspot-mikrotik/,Recursos Networking,3.7,109,500,14,540.0,IT_net_security
Web Hacking: Teste de Invasão em Sites e Aplicações Web,https://www.udemy.com/course/hacking-pentest-invasao-sites-aplicacoes-web/,Clécius Wilton,4.7,109,499,62,540.0,IT_net_security
Penetration Testing using Kali Linux,https://www.udemy.com/course/wnylhxmt/,Abdullah Al Araimi,3.8,108,1113,25,360.0,IT_net_security
Uygulama Destekli Kriptoloji Eğitimi,https://www.udemy.com/course/uygulama-destekli-kriptoloji-egitimi/,Mustafa Küçükakarsu,3.7,107,2563,64,690.0,IT_net_security
Temel Siber Güvenlik Eğitimi,https://www.udemy.com/course/herkes-icin-siber-guvenlik-egitimi/,Cemal TANER,4.3,107,462,55,240.0,IT_net_security
Modelagem de ameaças - Construção de sistemas seguros,https://www.udemy.com/course/modelagem-de-ameacas-construcao-de-sistemas-seguros/,Rafael Lachi,4.3,107,418,10,510.0,IT_net_security
Gerenciamento de senhas com Teampass,https://www.udemy.com/course/teampass/,FAME Treinamentos,3.9,107,293,7,90.0,IT_net_security
استخدام بايثون في اختبار الاختراق و التجسس علي الشبكة,https://www.udemy.com/course/python-for-pentesting/,Ahmed Elesawy,4.5,106,20448,30,330.0,IT_net_security
Anonimato: Diventa un Hacker invisibile!,https://www.udemy.com/course/anonimato-diventa-un-hacker-invisibile/,The Phoenix Group,4.6,106,620,49,240.0,IT_net_security
5G Fundamentos y Tecnologías,https://www.udemy.com/course/5g-fundamentos-y-tecnologias/,Diógenes Marcano,4.4,105,225,17,180.0,IT_net_security
Etik Hacker Olma - Gerçek Raporlar ve Sitelerde Bug Bounty,https://www.udemy.com/course/etik-hacker-olma-gercek-raporlar-ve-sitelerde-bug-bounty/,Ilkin Cavadov,4.7,105,5048,10,60.0,IT_net_security
Deep Web - Introducción a la Internet profunda,https://www.udemy.com/course/deep-web-introduccion-a-la-internet-profunda/,Thiago Araujo - +53.000 Estudiantes,4.7,105,7913,26,240.0,IT_net_security
"Administracion de Windows Server , GPOs para principiantes",https://www.udemy.com/course/administracion-de-windows-server-para-principiantes/,Juan José Pérez Figuereo,4.5,105,337,36,270.0,IT_net_security
Curso de Hacker - Básico,https://www.udemy.com/course/curso-de-hacker-basico/,Fernando Sena,3.9,104,302,24,240.0,IT_net_security
Windows ve Active Directory Güvenlik İpuçları |Hacking Ötesi,https://www.udemy.com/course/windows-ve-active-directory-guvenlik-ipuclari/,Ahmet Sait Duran,5.0,104,472,33,270.0,IT_net_security
Hacking Ético: Footprinting y Reconocimiento,https://www.udemy.com/course/hacking-etico-footprinting-y-reconocimiento/,OpenLearning España,4.1,104,545,36,240.0,IT_net_security
Redes en Microsoft Azure (2018),https://www.udemy.com/course/redes-en-microsoft-azure/,Jonatan Chinchilla,4.6,103,543,30,390.0,IT_net_security
Başlangıçtan İleri Seviyeye Uygulamalı Kriptoloji Eğitimi,https://www.udemy.com/course/baslangctan-ileri-seviyeye-uygulamal-kriptoloji-egitimi/,Baris Celiktas,4.5,103,580,93,780.0,IT_net_security
Video por IP usando NDI,https://www.udemy.com/course/ndi_video_ip/,Alberto Alonso Valdivia,4.7,103,216,27,270.0,IT_net_security
Seguridad Web del OWASP TOP TEN para principiantes,https://www.udemy.com/course/aprenda-a-reconocer-las-vulnerabilidades-del-owasp-top-ten/,Leandro Ferrari,3.8,102,275,48,120.0,IT_net_security
Linux Hacking Tools - Etik Hacker ve Siber Güvenlik Eğitimi,https://www.udemy.com/course/linux-hacking-tools-etik-hacker-ve-siber-guvenlik-egitimi/,Ali Çiftci,4.5,101,10788,74,390.0,IT_net_security
Workshop completo di base su tecnologia MikroTik RouterOS,https://www.udemy.com/course/mikrotik-mtcna/,Alejandro Fala',3.5,101,406,12,330.0,IT_net_security
Introdução ao SIP e Wireshark básico para VoIP,https://www.udemy.com/course/introducao-ao-sip/,Eddwan Hallen da Silva,4.7,101,266,63,120.0,IT_net_security
Siber Operasyonlar Güvenlik Temelleri Eğitimi,https://www.udemy.com/course/veyhurdam-ccna-cyber-ops-210-250-siber-turkce/,Veyhurdam Dikmen,4.4,100,414,85,540.0,IT_net_security
Metasploit Grundkurs,https://www.udemy.com/course/metasploit-grundkurs/,Tom Wechsler,4.6,100,739,31,210.0,IT_net_security
Redes BGP (sem suporte),https://www.udemy.com/course/redes-bgp/,Jordelson Santiago,4.8,100,407,23,210.0,IT_net_security
OpenVas GVM no Kali Linux para Ethical Hacking,https://www.udemy.com/course/gestao-de-vulnerabilidades-com-openvas-no-kali-linux-20211/,Feliciano Mangueleze,4.8,99,1390,106,750.0,IT_net_security
Sıfırdan Temel Ethical Hacker ve Siber Güvenlik Kursu,https://www.udemy.com/course/sfrdan-temel-ethical-hacker-ve-siber-guvenlik-kursu/,Mustafa Berat Kurt,4.2,98,4852,93,660.0,IT_net_security
Hacker Ético - Desvendando a Engenharia Social,https://www.udemy.com/course/hacker-etico-desvendando-a-engenharia-social/,Paulo Moraes,4.4,97,381,28,150.0,IT_net_security
Ethical Hacking - Curso Completo de SQL Injection,https://www.udemy.com/course/sql-injection-ia/,Rui Carreira,4.9,96,1155,94,630.0,IT_net_security
CISCO CCNA Lab Switch,https://www.udemy.com/course/cisco-ccna-lab-switch/,Kriangsak Namkot,4.9,96,857,27,240.0,IT_net_security
KNX/ETS - Fibel,https://www.udemy.com/course/knx-ets-fibel/,Torben Ledermann,4.3,96,749,99,600.0,IT_net_security
Especialista em Segurança da Informação na Prática,https://www.udemy.com/course/it-security-specialist-endpoint-protection/,Gonçalves F.,4.4,95,407,12,480.0,IT_net_security
Python Para Hackers,https://www.udemy.com/course/python-para-hackers/,Afonso da Silva E.,4.4,95,324,60,600.0,IT_net_security
サイバーセキュリティ入門、初めの一歩！,https://www.udemy.com/course/cybersec/,正木 美奈子,4.1,95,322,46,150.0,IT_net_security
Fundamentos del técnico en redes de fibra óptica,https://www.udemy.com/course/fibraoptica/,Formación TelecOcable,4.0,95,252,5,90.0,IT_net_security
Redes de Computadores via Satélite - Telecomunicações,https://www.udemy.com/course/tcp-ip-via-satelite-ipos/,Bruno Wanderley,4.9,95,519,32,240.0,IT_net_security
Firewall - pfSense Completo,https://www.udemy.com/course/curso-firewall-pfsense/,José Wellington,3.8,95,383,61,510.0,IT_net_security
Kali Linux para principiantes y Ethical Hacking Básico,https://www.udemy.com/course/kali-linux-para-principiantes-y-ethical-hacking-basico/,Erasmo Cesar Ortuño Morales,4.1,94,265,30,180.0,IT_net_security
Administración de IBM DataPower Gateway versión 7.6,https://www.udemy.com/course/administracion-de-ibm-datapower-gateway-version-76/,Jose Luis Pinto,4.7,94,437,80,960.0,IT_net_security
IT Sicherheitstests und Ethical Hacking mit Kali Linux,https://www.udemy.com/course/it-sicherheitstests-und-ethical-hacking-mit-kali-linux/,Tom Wechsler,4.6,94,1048,38,240.0,IT_net_security
The Complete Practical Ethical Hacking Expert in Hindi,https://www.udemy.com/course/ethical-hacking-course-in-hindi-certified-ethical-hacking-course-fees/,199courses Official,3.4,94,392,79,300.0,IT_net_security
Pfsense Firewall - Secure Browsing,https://www.udemy.com/course/pfsense-firewall-secure-browsing/,Juan José Pérez Figuereo,4.5,94,373,10,60.0,IT_net_security
Configuración básica de switches Cisco para principiantes,https://www.udemy.com/course/configuracion-basica-de-switches-cisco-para-principiantes/,Manuel Sepulveda,4.6,94,311,31,120.0,IT_net_security
Corso SOC Analyst Junior di I° Livello - CyberSecurity,https://www.udemy.com/course/corso-soc-analyst-junior-di-i-livello/,Kreeper BlueTeam,4.5,93,222,30,210.0,IT_net_security
Sophos XG Firewall Örnek Topoloji Çalışması,https://www.udemy.com/course/sophos-xg-firewall-ornek-topoloji-calismasi/,ilhan çiçek,4.7,93,4307,7,60.0,IT_net_security
Fibra Óptica Básico para Provedores de internet,https://www.udemy.com/course/fibra-optica-basico/,Gilson Barbosa,4.8,93,904,6,90.0,IT_net_security
Administração de Redes com Windows Server 2019,https://www.udemy.com/course/administracao-de-redes-com-windows-server-2019/,Hugo Vasconcelos,4.0,93,341,40,210.0,IT_net_security
Aprenda Ansible,https://www.udemy.com/course/aprenda-ansible/,Clayton Passos,4.6,93,493,54,540.0,IT_net_security
Curso de Analista de Redes e Telecomunicações,https://www.udemy.com/course/curso-de-analista-de-redes-e-telecomunicacoes/,Allan Almeida de Araujo,3.6,92,436,114,330.0,IT_net_security
Aprenda Web Hacking para Pentesters: Guia Prático,https://www.udemy.com/course/como-hackear-websites-para-pentesters-guia-pratico/,Afonso Alves,4.5,92,524,84,450.0,IT_net_security
Penetration Tester Beginner Kurs,https://www.udemy.com/course/penetration-tester-beginner-kurs/,"Dipl.-Ing. Daniel Mrskos, BSc",3.6,92,1525,10,60.0,IT_net_security
Curso de redes en Amazon Web Services,https://www.udemy.com/course/curso-de-redes-en-amazon-web-services/,Jonatan Chinchilla,4.7,91,372,36,390.0,IT_net_security
[テスト編] Nextjs + React-testing-libraryでモダンReactソフトウェアテスト,https://www.udemy.com/course/nextjs-react-testing-library-react/,Kazu .T,4.7,91,1417,39,270.0,IT_net_security
Pythonによるウェブスクレイピング（Python Web Scraping）,https://www.udemy.com/course/python-webscraping/,菊川正人 Kikukawa,3.9,91,1174,17,120.0,IT_net_security
Sonicwall Training | Treinamento Sonicwall,https://www.udemy.com/course/sonicwall-training/,Jefferson Shiguefuji,4.6,91,256,52,300.0,IT_net_security
ISO/IEC 27001 Implementando Seguridad de la Información,https://www.udemy.com/course/iso-27001-seguridad-de-la-informacion/,Grover Vásquez,4.5,91,408,87,510.0,IT_net_security
Fundamentos Cisco Networking Parte 2,https://www.udemy.com/course/recnet-icnd2/,Recursos Networking,4.5,91,780,47,1770.0,IT_net_security
Hacking Web Applications em Português,https://www.udemy.com/course/hacking-web-applications-em-portugues/,"Eslam Medhat (Ethical Hacking, Bug Bounty and Penetration Testing)",3.9,90,344,26,90.0,IT_net_security
Experto en TCP/IP,https://www.udemy.com/course/fundamentos-de-tcpip/,Academia de Redes,4.6,90,295,42,120.0,IT_net_security
Secure System Hacking,https://www.udemy.com/course/secure-system-hacking/,Arturo García,4.6,90,861,41,300.0,IT_net_security
[JIRA編]React Hooks/TypeScript + Django REST APIで作るオリジナルJIRA,https://www.udemy.com/course/jirareact-hookstypescript-django-rest-apijira/,Kazu .T,4.0,90,892,34,390.0,IT_net_security
Hacking de redes Wi-Fi,https://www.udemy.com/course/hacking-de-redes-wi-fi/,Joaquim Bochaca,4.4,89,398,39,300.0,IT_net_security
Python For Security Arabic,https://www.udemy.com/course/python-for-security-arabic/,Abdallah Elsokary,4.7,88,374,34,630.0,IT_net_security
Certification Cybersécurité : De Débutant à Expert 2022 +30h,https://www.udemy.com/course/certification-cybersecurite-de-debutant-a-expert/,Digital Innovation | Les Experts,4.6,88,928,196,1770.0,IT_net_security
Microsoft Azure Fundamentals - 10979,https://www.udemy.com/course/microsoft-azure-fundamentals-10979/,Marcos Feliciano,4.2,88,314,26,300.0,IT_net_security
Curso com 16 horas em instalação e configuração de CFTV CCTV,https://www.udemy.com/course/cftveredes/,Fabricio Evangelista,4.3,88,416,24,930.0,IT_net_security
Belajar Network Automation berbasis Web dengan Django,https://www.udemy.com/course/belajar-network-automation-berbasis-web-dengan-django/,Ahmad Rosid Komarudin,4.9,88,368,28,180.0,IT_net_security
Master en Metasploit. De 0 a Experto con Prácticas. Año 2022,https://www.udemy.com/course/metasploit-cero-experto-practicas-walter-coto-alvaro-chirou-2021/,Alvaro Chirou • 430.000+ Students Worldwide,4.6,87,705,73,780.0,IT_net_security
தமிழ் மொழியில் - Complete Hands on Ethical Hacking (Python),https://www.udemy.com/course/complete-ethical-hacking-with-python/,Ashwin Pk,3.8,87,277,113,960.0,IT_net_security
Palo Alto NGFW for Arab,https://www.udemy.com/course/palo-alto-ngfw-for-arab/,Mostafa El Lathy,4.2,87,3146,151,1470.0,IT_net_security
Ethical Hacking (WEB),https://www.udemy.com/course/ethical-hacking-web/,İsmail Döndü,4.7,87,4040,147,630.0,IT_net_security
Jaringan Komputer Menggunakan Cisco,https://www.udemy.com/course/jaringan-komputer-menggunakan-cisco/,Agus Setiawan,4.4,87,1266,30,780.0,IT_net_security
"NethServer , um linux com todos os serviços que você precisa",https://www.udemy.com/course/nethserver-um-linux-com-todos-os-servicos-que-voce-precisa/,DICARJ Empresa especializada em cursos Online,4.6,87,216,24,270.0,IT_net_security
Hacking Web - Análisis y Explotación de vulnerabilidades,https://www.udemy.com/course/hacking-web/,José Manuel De Aquino,4.8,87,882,52,390.0,IT_net_security
Fundamentos de los Servicios de Dominio de Active Directory,https://www.udemy.com/course/fundamentos-de-los-servicios-de-dominio-de-active-directory/,Victor Hugo Cárdenas Valenzuela,4.4,87,320,32,450.0,IT_net_security
"desbloquear y acceder a ANDROID, IPHONE y COMPUTADORAS",https://www.udemy.com/course/desbloquear-y-acceder-a-android-iphone-y-computadoras/,Oscar Rafael Duvernay Figueroa,3.8,87,5127,10,120.0,IT_net_security
Soluciones Seguridad Cisco,https://www.udemy.com/course/seguridadcisco/,Daniel Espinonsa,3.4,86,14218,44,840.0,IT_net_security
مدخل في عالم أختبار الأختراق-penetration testing,https://www.udemy.com/course/penetration-testing-i/,Zainab ali hadi,4.0,86,5262,20,90.0,IT_net_security
Basic Network,https://www.udemy.com/course/basic-network/,Kriangsak Namkot,4.3,84,377,18,180.0,IT_net_security
Controle de SPAMs com ASSP - Anti-Spam SMTP Proxy,https://www.udemy.com/course/spams-assp/,FAME Treinamentos,4.3,84,578,24,300.0,IT_net_security
Redes Wireless - Curso Avançado Profissional (Gerenciamento),https://www.udemy.com/course/redes-wireless-gerenciamento/,Bruno Wanderley,4.5,84,655,40,300.0,IT_net_security
Ferramentas Para SysAdmin & Administradores De Redes,https://www.udemy.com/course/ferramentasparasysadmin/,Weverton Batista Da Silva Rocha,4.3,84,1479,37,240.0,IT_net_security
KVM com LVM em Ambientes  Corporativos,https://www.udemy.com/course/kvmlinux/,Weverton Batista Da Silva Rocha,3.9,83,440,47,270.0,IT_net_security
Анонимность и Безопасность | Anonymity and Security,https://www.udemy.com/course/bolgarka/,Mefodiy Kelevra,4.7,83,657,7,780.0,IT_net_security
AWS CloudFormation - Introducción,https://www.udemy.com/course/aws-cloudformation-introduccion/,Fernando Hönig,4.5,82,446,10,90.0,IT_net_security
IP Adresi ve Subnetleme (IP Adressing and Subnetting),https://www.udemy.com/course/ip-adresi-ve-subnetleme-ip-adressing-and-subnetting/,ASIM YILDIZ,4.6,82,1011,16,240.0,IT_net_security
Aprenda a Configurar redes com o Packet Tracer,https://www.udemy.com/course/aprenda-a-configurar-redes-com-o-packet-tracer/,Sandro Teixeira Pinto,4.6,82,234,22,240.0,IT_net_security
High Performance React Web 開発,https://www.udemy.com/course/high-performance-react-web-django/,Kazu .T,4.7,81,839,30,270.0,IT_net_security
За тобой не прийдут с болгаркой V2. Volume 1,https://www.udemy.com/course/bolgarka2/,Mefodiy Kelevra,4.3,81,659,45,450.0,IT_net_security
Ethical Hacker 2,https://www.udemy.com/course/ethical-hacker-2-2018/,Giuseppe Compare,4.1,81,470,17,150.0,IT_net_security
CISCO CCNA - Módulo 1 - Introdução à Redes,https://www.udemy.com/course/introducao-a-redes/,Marcos César,4.4,81,305,44,570.0,IT_net_security
Splunk Installation and SPL - Splunk (SIEM) Kurulumu ve SPL,https://www.udemy.com/course/splunk-siem-kurulumu-ve-splunk-processing-language-egitimi/,ASIM YILDIZ,4.3,81,544,33,180.0,IT_net_security
Curso Profesional de Endian Firewall Community (Español),https://www.udemy.com/course/curso-de-endian-firewall/,Frank Harbey Sanabria Florez,4.7,81,277,63,660.0,IT_net_security
Subneteo de Redes,https://www.udemy.com/course/subneteo-de-redes/,Oscar Leonel Amaya Deras,4.5,81,1532,5,60.0,IT_net_security
ENDIAN FIREWALL COMMUNITY Administração profissional,https://www.udemy.com/course/endian-firewall-community-administracao-profissional/,Gilberto Gonzaga de Figueiredo,5.0,81,380,74,870.0,IT_net_security
Hacking Éthique : Ingénierie Sociale,https://www.udemy.com/course/hacking-ethique-ingenierie-sociale/,Michel Kartner,4.7,80,627,53,330.0,IT_net_security
[SNS編] React Hooks + Django RestFramework API でフルスタックWeb開発,https://www.udemy.com/course/sns-react-hooks-django-restframework-api-web/,Kazu .T,4.5,80,805,49,510.0,IT_net_security
Administrar Windows Server 2019 | Herramientas Esenciales,https://www.udemy.com/course/administrar-windows-server-2019-herramientas-esenciales/,Ricardo Alas,4.1,80,6136,16,150.0,IT_net_security
[Youtube編] React Hooks + Django RestFramework API でフルスタックWeb,https://www.udemy.com/course/youtube-react-hooks-django-restframework-api-web/,Kazu .T,4.5,80,817,43,300.0,IT_net_security
pfSense - Fundamentos y Administración - en Español,https://www.udemy.com/course/pfsense-fundamentos-y-administracion-en-espanol/,Ruben Toriel,4.6,79,314,19,660.0,IT_net_security
Curso de Ubiquiti EdgeRouter do básico ao avançado!,https://www.udemy.com/course/edgerouter/,Vitor Mazuco,4.2,79,420,72,810.0,IT_net_security
Apprendre Windows Serveur 2019 et le Réseau,https://www.udemy.com/course/apprendre-windows-serveur-2019-et-le-reseau/,Jean-philippe Parein,4.5,79,342,50,390.0,IT_net_security
Hackerların Google'i Shodan'ı her yönü ile öğrenmek.,https://www.udemy.com/course/hackerlarn-googlei-shodan-her-yonu-ile-ogrenmek-ve/,Ozan Akyol,3.5,79,322,23,150.0,IT_net_security
Aprender OWASP TOP TEN en .NET para principiantes,https://www.udemy.com/course/aprenda-el-top-ten-de-vulnerabilidades-en-aplicaciones-net/,Leandro Ferrari,3.0,78,250,37,180.0,IT_net_security
தமிழ் மொழியில் - மெட்டாஸ்ப்ளோயிட் ஹேண்ட்ஸ் ஒன் மூலம் ஊடுருவல,https://www.udemy.com/course/penetration-testing-with-metasploit-in-tamil-handson/,Venkatesh Chennuri,4.2,78,403,69,570.0,IT_net_security
Hacking a Dispositivos Móviles,https://www.udemy.com/course/hacking-a-dispositivos-moviles/,Thiago Araujo - +53.000 Estudiantes,3.8,78,1009,32,150.0,IT_net_security
Toma de evidencias en móviles con Android,https://www.udemy.com/course/toma-de-evidencias-en-moviles-con-android/,Diego Hernán Barrientos,4.8,78,367,50,240.0,IT_net_security
دورة أساسيات الشبكات,https://www.udemy.com/course/networkbasics/,YasserRED .,3.8,77,283,19,180.0,IT_net_security
Python Black-Hat voltado para Segurança Computacional,https://www.udemy.com/course/python-black-hat/,Weidsom Nascimento,4.2,77,397,18,90.0,IT_net_security
Netzwerkanalyse mit Wireshark,https://www.udemy.com/course/netzwerkanalyse-mit-wireshark/,Tom Wechsler,4.4,78,553,25,180.0,IT_net_security
【サイバーセキュリティ完全攻略】ホワイトハッカー養成講座 (インシデントハンドリング&Windowsアタック編）,https://www.udemy.com/course/windows-hacking/,黒川 彰久,3.9,77,1293,23,300.0,IT_net_security
Curso IOTA : La evolución del Bitcoin y Blockchain,https://www.udemy.com/course/curso-iota-la-evolucion-del-bitcoin-y-blockchain/,Alberto Susin,4.2,77,244,29,180.0,IT_net_security
Tespit Edilemeyen Malware Saldırıları,https://www.udemy.com/course/tespit-edilemeyen-malware-saldirilar/,Mehmet Okan KALENDER,4.7,77,413,26,480.0,IT_net_security
ESPAÑOL - Curso Huawei HCIA Routing & Switching ENTRY,https://www.udemy.com/course/espanol-curso-huawei-hcia-routing-switching-entry/,José Manuel Izquierdo Hernández,4.7,76,259,13,630.0,IT_net_security
Corso di Cyber Security,https://www.udemy.com/course/corso-di-cyber-security/,Add Skills,3.2,75,239,15,150.0,IT_net_security
"Curso de Zabbix completo, desde 0 a experto",https://www.udemy.com/course/curso-de-zabbix-completo-desde-0-a-experto/,Arturo Diaz Lora,4.5,75,1579,18,180.0,IT_net_security
Palo Alto Firewall Network Security Eğitimi (v10),https://www.udemy.com/course/palo-alto-firewall-egitimi/,Yavuz BULUT,4.5,75,254,43,210.0,IT_net_security
DVR. Una aventura al detalle del núcleo del CCTV.,https://www.udemy.com/course/dvr-una-aventura-al-detalle-del-nucleo-del-cctv/,Flavio Silva,3.3,75,255,37,270.0,IT_net_security
Sıfırdan İleri Seviyeye Etik Hacker Olma Kursu,https://www.udemy.com/course/sfrdan-ileri-seviyeye-siber-guvenlik/,Ahmed Semih Özmekik,4.1,75,558,227,1860.0,IT_net_security
UNIVERSIDAD DEEP WEB y DARK WEB,https://www.udemy.com/course/la-deep-web-curso-completo/,Oscar Rafael Duvernay Figueroa,4.3,74,3780,26,870.0,IT_net_security
"VPN мастеркласс. Public VPN, Personal VPN, WireGuard VPN",https://www.udemy.com/course/killervpn/,Mefodiy Kelevra,4.2,73,611,7,120.0,IT_net_security
Hacking Éthique : Metasploit & Exploits Zero-days,https://www.udemy.com/course/hacking-ethique-metasploit-exploits-zero-days/,Valery KONAN,4.2,73,588,80,390.0,IT_net_security
Seguridad Informática 101 - Ciberseguridad,https://www.udemy.com/course/seguridadinformacion/,Fernando Cuervo,4.3,73,411,27,60.0,IT_net_security
CISCO MPLS VPN CAMADA 3,https://www.udemy.com/course/mpls-vpn-camada-3/,André Zanon,3.3,73,343,28,120.0,IT_net_security
pfSense: Firewall Profissional,https://www.udemy.com/course/pfsense-firewall-profissional/,Marcos Prochnow,4.8,73,285,50,480.0,IT_net_security
CyberSecurity & Privacy,https://www.udemy.com/course/cybersecurity-privacy/,Exprivia S.p.a.,4.5,73,222,6,120.0,IT_net_security
Sıfırdan Etik Hacker Olma Kursu (Kali Linux),https://www.udemy.com/course/sfrdan-etik-hacker-olma-kursu-kali-linux/,Hikmet Can,2.8,72,5259,67,420.0,IT_net_security
EasyFOP - LE DEPLOIEMENT D'UN RESEAU DE FIBRE OPTIQUE,https://www.udemy.com/course/easyfop-le-deploiement-dun-reseau-de-fibre-optique/,Bass BICI Expertise,4.4,72,177,27,120.0,IT_net_security
Pasar de SQLServer a Firebase en Xamarin forms,https://www.udemy.com/course/pasar-de-sqlserver-a-firebase-en-xamarin-forms-2021/,Codigo 369,4.8,72,21905,36,240.0,IT_net_security
Curso Distribuidor Wisp | Como vender servicio de internet,https://www.udemy.com/course/curso-distribuidor-wisp/,Henry paredes,3.9,72,257,33,390.0,IT_net_security
CompTIA Security+(SY601) Eğitim Kursu | Comptia Security +,https://www.udemy.com/course/comptia-securitysy601-egitim-kursu-comptia-security/,Oak Academy,4.2,72,191,104,450.0,IT_net_security
"Netzwerktechnik, Netzsicherheit und Wireshark",https://www.udemy.com/course/netzwerktechnik-netzsicherheit-wireshark/,Cedric Mössner,3.7,71,1128,113,930.0,IT_net_security
Fortigate Firewall NSE4 Training in Urdu/Hindi,https://www.udemy.com/course/fortigate-firewall-nse4-training-in-hindiurdu/,Ahmad Ali,4.4,71,285,58,1500.0,IT_net_security
GraphQL フルスタックWeb開発入門 (Django + React/Apollo Client),https://www.udemy.com/course/graphql-web-django-reactapollo-client/,Kazu .T,4.4,71,794,30,330.0,IT_net_security
Etik Hacker Olma: Ağ Temelleri ve Ağ Katmanı Saldırıları,https://www.udemy.com/course/etik-hacker-ag-temelleri-ve-ag-katman-saldrlar-kursu/,Oak Academy,4.5,71,1553,87,390.0,IT_net_security
Hack website  8in1 | الشامل في اختراق المواقع,https://www.udemy.com/course/hack-website-full-course/,المبرمج العربي,4.8,71,4821,62,450.0,IT_net_security
